{
  "slot": 1,
  "multi_set_enabled": true,
  "detail_level": "FULL",
  "access_scopes": [
    "st2138:mon",
    "st2138:op",
    "st2138:cfg",
    "st2138:adm"
  ],
  "default_scope": "st2138:op",
  "params": {
    "product": {
      "type": "STRUCT",
      "access_scope": "st2138:mon",
      "read_only": true,
      "value": {
        "struct_value": {
          "fields": {
            "name": { "string_value": "External Object Request" },
            "vendor": { "string_value": "Ross Video" },
            "version": { "string_value": "1.0.0" },
            "serial_number": { "string_value": "SN-7K9M-2024-XR485-BLU" }
          }
        }
      },
      "params": {
        "name": {
          "type": "STRING"
        },
        "vendor": {
          "type": "STRING"
        },
        "version": {
          "type": "STRING"
        },
        "st2138_sdk": {
          "type": "STRING"
        },
        "st2138_sdk_version": {
          "type": "STRING"
        },
        "serial_number": {
          "type": "STRING"
        }
      }
    },
    "number": {
      "type": "STRUCT_VARIANT",
      "params" : {
        "words": {
          "type": "STRING"
        },
        "digits": {
          "type": "INT32"  
        }
      },
      "value": {
        "struct_variant_value": {
          "struct_variant_type": "words",
          "value": {
            "string_value": "one"
          }
        }
      }
    },
    "cartesian": {
      "type": "STRUCT",
      "params": {
        "x": {
          "type": "INT32"
        },
        "y": {
          "type": "INT32"
        },
        "z": {
          "type": "INT32"
        }
      },
      "value": {
        "struct_value": {
          "fields": {
            "x": {"int32_value": 5},
            "y": {"int32_value": 10},
            "z": {"int32_value": 15}
          }
        }
      }
    },
    "coordinates": {
      "type": "STRUCT_VARIANT_ARRAY",
      "params": {
        "cartesian": {
          "type": "STRUCT",
          "template_oid": "cartesian"
        },
        "cylindrical": {
          "type": "STRUCT",
          "params": {
            "rho": {
              "type": "INT32"
            },
            "phi": {
              "type": "INT32",
              "constraint": {
                "type": "INT_RANGE",
                "int32_range": {
                  "min_value": 0,
                  "max_value": 360
                }
              }
            },
            "z": {
              "type": "INT32"
            }
          }
        },
        "spherical": {
          "type": "STRUCT",
          "params": {
            "r": {
              "type": "INT32"
            },
            "phi": {
              "type": "INT32",
              "constraint": {
                "type": "INT_RANGE",
                "int32_range": {
                  "min_value": 0,
                  "max_value": 180
                }
              }
            },
            "theta": {
              "type": "INT32",
              "constraint": {
                "type": "INT_RANGE",
                "int32_range": {
                  "min_value": 0,
                  "max_value": 360
                }
              }
            }
          }
        }
      },
      "value": {
        "struct_variant_array_values": {
          "struct_variants": [
            {
              "struct_variant_type": "cartesian",
              "value": {
                "struct_value": {
                  "fields": {
                    "x": {"int32_value": 1},
                    "y": {"int32_value": 2},
                    "z": {"int32_value": 3}
                  }
                }
              }
            },
            {
              "struct_variant_type": "cylindrical",
              "value": {
                "struct_value": {
                  "fields": {
                    "rho": {"int32_value": 1},
                    "phi": {"int32_value": 90},
                    "z": {"int32_value": 3}
                  }
                }
              }
            },
            {
              "struct_variant_type": "spherical",
              "value": {
                "struct_value": {
                  "fields": {
                    "r": {"int32_value": 1},
                    "theta": {"int32_value": 90},
                    "phi": {"int32_value": 180}
                  }
                }
              }
            }
          ]
        }
      }
    }
  }
}