{
  "slot": 1,
  "multi_set_enabled": true,
  "detail_level": "FULL",
  "access_scopes": ["st-2138:mon", "st-2138:op", "st-2138:cfg", "st-2138:adm"],
  "default_scope": "st-2138:op",
  "subscriptions": true,
  "language_packs": {
    "packs": {
      "es": {
        "name": "Spanish",
        "words": {
          "greeting": "Hola",
          "parting": "Adiós"
        }
      },
      "en": {
        "name": "English",
        "words": {
          "greeting": "Hello",
          "parting": "Goodbye"
        }
      },
      "fr": {
        "name": "French",
        "words": {
          "greeting": "Bonjour",
          "parting": "Adieu"
        }
      }
    }
  },
  "params": {
    "text_box": {
      "type": "STRING",
      "name": { "display_strings": { "en": "Text Box", "es": "Caja de Texto", "fr": "Boîte de Texte" } },
      "access_scope": "st-2138:cfg",
      "value": { "string_value": "This is device a" }
    }
  }
}
