{
  "slot": 1,
  "multi_set_enabled": true,
  "detail_level": "FULL",
  "access_scopes": ["st2138:mon", "st2138:op", "st2138:cfg", "st2138:adm"],
  "default_scope": "st2138:op",
  "language_packs": {
    "packs": {
      "es": {
        "name": "Spanish",
        "words": {
          "greeting": "Hola",
          "parting": "Adiós"
        }
      },
      "en": {
        "name": "English",
        "words": {
          "greeting": "Hello",
          "parting": "Goodbye"
        }
      },
      "fr": {
        "name": "French",
        "words": {
          "greeting": "Bonjour",
          "parting": "Adieu"
        }
      }
    }
  },
  "params": {
    "product": {
      "type": "STRUCT",
      "access_scope": "st2138:mon",
      "read_only": true,
      "value": {
        "struct_value": {
          "fields": {
            "name": { "string_value": "Hello World" },
            "vendor": { "string_value": "Ross Video" },
            "version": { "string_value": "1.0.0" },
            "serial_number": { "string_value": "SN-7K9M-2024-XR485-BLU" }
          }
        }
      },
      "params": {
        "name": {
          "type": "STRING"
        },
        "vendor": {
          "type": "STRING"
        },
        "version": {
          "type": "STRING"
        },
        "catena_sdk": {
          "type": "STRING"
        },
        "catena_sdk_version": {
          "type": "STRING"
        },
        "serial_number": {
          "type": "STRING"
        }
      }
    },
    "hello": {
      "type": "STRING",
      "name": { "display_strings": { "$key": "greeting" } },
      "value": { "string_value": "Hello, World!" }
    },
    "count": {
      "type": "INT32",
      "value": { "int32_value": 1234 },
      "name": { "display_strings": { "en": "Counter" } }
    },
    "gain": {
      "type": "FLOAT32",
      "value": { "float32_value": 0.707 },
      "name": { "display_strings": { "en": "Audio Gain" } },
      "widget": "fader"
    },
    "phonetic_alphabet": {
      "type": "STRING_ARRAY",
      "name": { "display_strings": { "en": "Phonetic Alphabet" } },
      "value": {
        "string_array_values": {
          "strings": ["Alpha", "Bravo", "Charlie", "..."]
        }
      }
    },
    "primes": {
      "type": "INT32_ARRAY",
      "name": { "display_strings": { "en": "The First Few Primes" } },
      "value": {
        "int32_array_values": {
          "ints": [2, 3, 5, 7, 11, 13, 17, 19, 23, 29]
        }
      }
    },
    "physical_constants": {
      "type": "FLOAT32_ARRAY",
      "name": { "display_strings": { "en": "Some Physical Constants" } },
      "value": {
        "float32_array_values": {
          "floats": []
        }
      }
    }
  }
}

