{
  "slot": 1,
  "multi_set_enabled": true,
  "detail_level": "FULL",
  "access_scopes": ["st2138:mon","st2138:op","st2138:cfg","st2138:adm"],
  "default_scope": "st2138:op",
  "language_packs": {},
  "params": {
    "product": {
      "type": "STRUCT",
      "access_scope": "st2138:mon",
      "read_only": true,
      "value": {
        "struct_value": {
          "fields": {
            "name": { "string_value": "External Object Request" },
            "vendor": { "string_value": "Ross Video" },
            "version": { "string_value": "1.0.0" },
            "serial_number": { "string_value": "SN-7K9M-2024-XR485-BLU" }
          }
        }
      },
      "params": {
        "name": {
          "type": "STRING"
        },
        "vendor": {
          "type": "STRING"
        },
        "version": {
          "type": "STRING"
        },
        "catena_sdk": {
          "type": "STRING"
        },
        "catena_sdk_version": {
          "type": "STRING"
        },
        "serial_number": {
          "type": "STRING"
        }
      }
    },
    "city": {
      "type": "STRUCT",
      "name": {
        "display_strings": {
          "en": "City"
        }
      },
      "params": {
        "city_name": {
          "type": "STRING",
          "name": {
            "display_strings": {
              "en": "Name"
            }
          }
        },
        "latitude": {
          "type": "FLOAT32",
          "name": {
            "display_strings": {
              "en": "Latitude"
            }
          }
        },
        "longitude": {
          "type": "FLOAT32",
          "name": {
            "display_strings": {
              "en": "Longitude"
            }
          }
        },
        "population": {
          "type": "INT32",
          "name": {
            "display_strings": {
              "en": "Population"
            }
          }
        }
      }
    },
    "ottawa": {
      "type": "STRUCT",
      "template_oid": "city",
      "name": {
        "display_strings": {
          "en": "Ottawa"
        }
      },
      "value": {
        "struct_value": {
          "fields": {
            "city_name": {"string_value": "Ottawa"},
            "latitude": {"float32_value": 45.4215},
            "longitude": {"float32_value": -75.6972},
            "population": {"int32_value": 934243}
          }
        }
      }
    },
    "toronto": {
      "type": "STRUCT",
      "template_oid": "city",
      "name": {
        "display_strings": {
          "en": "Toronto"
        }
      },
      "value": {
        "struct_value": {
          "fields": {
            "city_name": {"string_value": "Toronto"},
            "latitude": {"float32_value": 43.6511},
            "longitude": {"float32_value": -79.3470},
            "population": {"int32_value": 2731571}
          }
        }
      }
    }
  }
}