{
  "slot": 0,
  "multi_set_enabled": true,
  "detail_level": "FULL",
  "access_scopes": ["st2138:mon", "st2138:op", "st2138:cfg", "st2138:adm"],
  "default_scope": "st2138:op",
  "language_packs": {
    "packs": {
      "es": {
        "name": "Spanish",
        "words": {
          "greeting": "Hola",
          "parting": "Adiós"
        }
      },
      "en": {
        "name": "English",
        "words": {
          "greeting": "Hello",
          "parting": "Goodbye"
        }
      },
      "fr": {
        "name": "French",
        "words": {
          "greeting": "Bonjour",
          "parting": "Adieu"
        }
      }
    }
  },
  "menu_groups": {
    "status": {
      "name": { "display_strings": { "en": "status", "es": "estado", "fr": "statut" } },
      "menus": {
        "page_1": {
          "name": { "display_strings": { "en": "Product", "es": "Producto", "fr": "Produit" } },
          "param_oids": ["product/name", "product/vendor", "product/version", "product/serial_number", "product/catena_sdk", "product/catena_sdk_version"]
        },
        "page_2": {
          "name": { "display_strings": { "en": "Page 2", "es": "Página 2", "fr": "Page 2" } },
          "param_oids": ["offset", "button", "counter"]
        }
      },
      "order": 0
    },
    "config": {
      "name": { "display_strings": { "en": "config", "es": "configuración", "fr": "configuration" } },
      "menus": {
        "page_1": {
          "name": { "display_strings": { "en": "Page 1", "es": "Página 1", "fr": "Page 1" } },
          "param_oids": ["counter", "hello"]
        },
        "page_2": {
          "name": { "display_strings": { "en": "Page 2", "es": "Página 2", "fr": "Page 2" }},
          "param_oids": ["offset", "button", "inline_button", "counter"]
        }
      },
      "order": 1
    }
  },
  "params": {
    "product": {
      "type": "STRUCT",
      "access_scope": "st2138:mon",
      "read_only": true,
      "value": {
        "struct_value": {
          "fields": {
            "name": { "string_value": "Use Menus" },
            "vendor": { "string_value": "Ross Video" },
            "version": { "string_value": "1.0.0" },
            "serial_number": { "string_value": "SN-7K9M-2024-XR485-BLU" }
          }
        }
      },
      "params": {
        "name": {
          "type": "STRING"
        },
        "vendor": {
          "type": "STRING"
        },
        "version": {
          "type": "STRING"
        },
        "catena_sdk": {
          "type": "STRING"
        },
        "catena_sdk_version": {
          "type": "STRING"
        },
        "serial_number": {
          "type": "STRING"
        }
      }
    },
    "counter": {
      "type": "INT32",
      "name": { "display_strings": { "en": "Counter", "es": "Contador", "fr": "Compteur" } },
      "value": { "int32_value": 0 }
    },
    "hello": {
      "type": "STRING",
      "name": { "display_strings": { "en": "Text Box", "es": "Caja de texto", "fr": "Boîte de texte" } },
      "access_scope": "st2138:cfg",
      "value": { "string_value": "Hello, World!" }
    },
    "button": {
      "type": "INT32",
      "name": { "display_strings": { "en": "Button", "es": "Botón", "fr": "Bouton" } },
      "value": { "int32_value": 0 },
      "widget": "toggle",
      "constraint": { "ref_oid": "basic_button" }
    },
    "inline_button": {
      "type": "INT32",
      "name": { "display_strings": { "en": "Inline Button", "es": "Botón en línea", "fr": "Bouton en ligne" } },
      "value": { "int32_value": 0 },
      "widget": "toggle",
      "constraint": {
        "type": "INT_CHOICE",
        "int32_choice": {
          "choices": [
            {  "name": { "display_strings": { "en": "Off", "es": "Apagado", "fr": "Éteint" } },  "value": 0 },
            {  "name": { "display_strings": { "en": "On", "es": "Encendido", "fr": "Allumé" } }, "value": 1 }
          ]
        }
      }
    },
    "offset": {
      "type": "INT32",
      "name": { "display_strings": { "en": "offset" } },
      "access_scope": "st2138:cfg",
      "value": { "int32_value": 0 },
      "constraint": {
        "type": "INT_RANGE",
        "int32_range": {
          "min_value": -10,
          "max_value": 10,
          "step": 1
        }
      }
    }
  },
  "constraints": {
    "basic_button": {
      "type": "INT_CHOICE",
      "int32_choice": {
        "choices": [
          { "name": { "display_strings": { "en": "Off", "es": "Apagado", "fr": "Éteint" } },  "value": 0  },
          { "name": { "display_strings": { "en": "On", "es": "Encendido", "fr": "Allumé" } }, "value": 1 }
        ]
      }
    }
  }
}
