{
  "slot": 1,
  "multi_set_enabled": true,
  "detail_level": "FULL",
  "access_scopes": ["monitor", "operate", "configure", "administer"],
  "default_scope": "operate",
  "params": {
    "a_number": {
      "type": "INT32",
      "value": { "int32_value": 1234 },
      "name": { "display_strings": { "en": "Int Example" } }
    },
    "float_example": {
      "type": "FLOAT32",
      "value": { "float32_value": 1234.5678},
      "name": { "display_strings": { "en": "Float Example" } }
    },
    "string_example": {
      "type": "STRING",
      "value": { "string_value": "Hello, World!" },
      "name": { "display_strings": { "en": "String Example" } }
    },
    "number_array": {
      "type": "INT32_ARRAY",
      "value": { "int32_array_values": { "ints": [1, 2, 3, 4] } },
      "name": { "display_strings": { "en": "Int Array Example" } }
    },
    "location": {
      "type": "STRUCT",
      "params": {
        "latitude": {
          "type": "FLOAT32",
          "name": {
            "display_strings": {
              "en": "Latitude"
            }
          },
          "value": {
            "float32_value": 37.7749
          }
        },
        "longitude": {
          "type": "FLOAT32",
          "name": {
            "display_strings": {
              "en": "Longitude"
            }
          },
          "value": {
            "float32_value": -122.4194
          }
        }
      },
      "name": {
        "display_strings": {
          "en": "Location"
        }
      },
      "value": {
        "struct_value": {
          "fields": {
            "latitude": {
              "value": {
                "float32_value": 37.7749
              }
            },
            "longitude": {
              "value": {
                "float32_value": -122.4194
              }
            }
          }
        }
      }
    }
  },
  "menu_groups": {
    "status_group": {
      "name": { "display_strings": { "en": "Status" } },
      "menus": {
        "status": {
          "name": { "display_strings": { "en": "Product" } },
          "param_oids": ["/a_number"]
        }
      }
    },
    "config_group": {
      "name": { "display_strings": { "en": "Config" } },
      "menus": {
        "config": {
          "name": { "display_strings": { "en": "Catena" } },
          "param_oids": ["/string_example", "/float_example"]
        }
      }
    }
  }
}
