{
  "slot": 1,
  "multi_set_enabled": true,
  "detail_level": "FULL",
  "access_scopes": ["st2138:mon", "st2138:op", "st2138:cfg", "st2138:adm"],
  "default_scope": "st2138:op",
  "language_packs": {},
  "params": {
    "product": {
      "type": "STRUCT",
      "access_scope": "st2138:mon",
      "read_only": true,
      "value": {
        "struct_value": {
          "fields": {
            "name": { "string_value": "External Object Request" },
            "vendor": { "string_value": "Ross Video" },
            "version": { "string_value": "1.0.0" },
            "catena_sdk": { "string_value": "https://github.com/rossvideo/Catena.git" },
            "serial_number": { "string_value": "SN-7K9M-2024-XR485-BLU" }
          }
        }
      },
      "params": {
        "name": {
          "type": "STRING"
        },
        "vendor": {
          "type": "STRING"
        },
        "version": {
          "type": "STRING"
        },
        "catena_sdk": {
          "type": "STRING"
        },
        "catena_sdk_version": {
          "type": "STRING"
        },
        "serial_number": {
          "type": "STRING"
        }
      }
    },
    "eq": {
      "type": "STRUCT",
      "name": { "display_strings": { "en": "EQ" } },
      "params": {
        "response": {
          "type": "INT32",
          "name": { "display_strings": { "en": "Response" } }
        },
        "frequency": {
          "type": "FLOAT32",
          "name": { "display_strings": { "en": "Frequency" } }
        },
        "gain": {
          "type": "FLOAT32",
          "name": { "display_strings": { "en": "Gain" } }
        },
        "q_factor": {
          "type": "FLOAT32",
          "name": { "display_strings": { "en": "Q Factor" } }
        }
      }
    },
    "audio_channel": {
      "type": "STRUCT",
      "name": { "display_strings": { "en": "Audio Channel" } },
      "params": {
        "fader": {
          "type": "FLOAT32",
          "name": { "display_strings": { "en": "Fader" } }
        },
        "eq_list": {
          "type": "STRUCT_ARRAY",
          "name": { "display_strings": { "en": "EQ List" } },
          "template_oid": "eq",
          "value": {
            "struct_array_values": {
              "struct_values": [
                {
                  "fields": {
                    "response": {"int32_value": 0},
                    "frequency": {"float32_value": 0},
                    "gain": {"float32_value": 0},
                    "q_factor": {"float32_value": 0}
                  }
                },
                {
                  "fields": {
                    "response": {"int32_value": 0},
                    "frequency": {"float32_value": 0},
                    "gain": {"float32_value": 0},
                    "q_factor": {"float32_value": 0}
                  }
                }
              ]
            }
          }
        }
      }
    },
    "audio_deck": {
      "type": "STRUCT_ARRAY",
      "name": { "display_strings": { "en": "Audio Deck" } },
      "template_oid": "audio_channel",
      "value": {
        "struct_array_values": {
          "struct_values": [
            {
              "fields": {
                "fader": {"float32_value": 0.0},
                "eq_list": {
                  "struct_array_values": {
                    "struct_values": [
                      {
                        "fields": {
                          "response": {"int32_value": 1},
                          "frequency": {"float32_value": 100},
                          "gain": {"float32_value": 0},
                          "q_factor": {"float32_value": 0}
                        }
                      },
                      {
                        "fields": {
                          "response": {"int32_value": 2},
                          "frequency": {"float32_value": 200},
                          "gain": {"float32_value": 0},
                          "q_factor": {"float32_value": 0}
                        }
                      }
                    ]
                  }
                }
              }
            },
            {
              "fields": {
                "fader":{"float32_value": 0.1},
                "eq_list": {
                  "struct_array_values": {
                    "struct_values": [
                      {
                        "fields": {
                          "response": {"int32_value": 3},
                          "frequency": {"float32_value": 300},
                          "gain": {"float32_value": 0},
                          "q_factor": {"float32_value": 0}
                        }
                      },
                      {
                        "fields": {
                          "response": {"int32_value": 4},
                          "frequency": {"float32_value": 400},
                          "gain": {"float32_value": 0},
                          "q_factor": {"float32_value": 0}
                        }
                      }
                    ]
                  }
                }
              }
            },
            {
              "fields": {
                "fader":{"float32_value": 0.2},
                "eq_list": {
                  "struct_array_values": {
                    "struct_values": [
                      {
                        "fields": {
                          "response": {"int32_value": 5},
                          "frequency": {"float32_value": 500},
                          "gain": {"float32_value": 0},
                          "q_factor": {"float32_value": 0}
                        }
                      },
                      {
                        "fields": {
                          "response": {"int32_value": 6},
                          "frequency": {"float32_value": 600},
                          "gain": {"float32_value": 0},
                          "q_factor": {"float32_value": 0}
                        }
                      }
                    ]
                  }
                }
              }
            },
            {
              "fields": {
                "fader":{"float32_value": 0.3},
                "eq_list": {
                  "struct_array_values": {
                    "struct_values": [
                      {
                        "fields": {
                          "response": {"int32_value": 7},
                          "frequency": {"float32_value": 700},
                          "gain": {"float32_value": 0},
                          "q_factor": {"float32_value": 0}
                        }
                      },
                      {
                        "fields": {
                          "response": {"int32_value": 8},
                          "frequency": {"float32_value": 800},
                          "gain": {"float32_value": 0},
                          "q_factor": {"float32_value": 0}
                        }
                      }
                    ]
                  }
                }
              }
            }
          ]
        }
      }
    }
  }
}
