{
  "slot": 0,
  "multi_set_enabled": true,
  "detail_level": "FULL",
  "access_scopes": ["st2138:mon", "st2138:op", "st2138:cfg", "st2138:adm"],
  "subscriptions": true,
  "default_scope": "st2138:mon",
  "language_packs": {},
  "params": {
    "dashboard_UI": {
      "type": "STRING",
      "oid_aliases": ["0xFF0E"],
      "read_only": true,
      "value": { "string_value": "eo://AudioDeck.grid" }
    },
    "dashboard_icon": {
      "type": "STRING",
      "oid_aliases": ["0xFF0C"],
      "read_only": true,
      "value": { "string_value": "eo://catena_logo.png" }
    },
    "audio_deck": {
      "type": "STRUCT_ARRAY",
      "name": { "display_strings": { "en": "Audio Deck" } },
      "params": {
        "gain": { "name": { "display_strings": { "ai": "Preamp gain in dB (-10.0 to 10.0). Adjust to match source level." } }, "type": "FLOAT32", "precision": 1, "constraint": { "type": "FLOAT_RANGE", "float_range": { "min_value": -10.0, "max_value": 10.0, "display_min": -10.0, "display_max": 10.0, "step": 0.1 } } },
        "input": { "name": { "display_strings": { "ai": "Realtime input level meter in dB (stateless). Agents read only." } }, "type": "FLOAT32", "precision": 2, "stateless": true, "constraint": { "type": "FLOAT_RANGE", "float_range": { "min_value": -10.0, "max_value": 10.0, "display_min": -10.0, "display_max": 10.0, "step": 0.01 } } },
        "inputLabel": { "name": { "display_strings": { "ai": "Editable input label shown to operators. Provide a human-friendly source name." } }, "type": "STRING" },
        "invert": { "name": { "display_strings": { "ai": "Polarity toggle. 'Inverted' = flipped polarity; 'Invert' = normal." } }, "type": "STRING", "widget": "toggle", "constraint": { "type": "STRING_CHOICE", "string_choice": { "choices": ["Inverted","Invert"] } } },
        "roll_off": { "name": { "display_strings": { "ai": "Filter slope in dB/oct. Typical 6-24; higher = steeper." } }, "type": "FLOAT32", "precision": 1, "constraint": { "type": "FLOAT_RANGE", "float_range": { "min_value": -30.0, "max_value": 30.0, "display_min": -30.0, "display_max": 30.0, "step": 1.0 } } },
        "frequency": { "name": { "display_strings": { "ai": "Filter cutoff/center frequency in Hz (0-500)." } }, "type": "FLOAT32", "precision": 0, "constraint": { "type": "FLOAT_RANGE", "float_range": { "min_value": 0.0, "max_value": 500.0, "display_min": 0.0, "display_max": 500.0, "step": 1.0 } } },
        "ripple": { "name": { "display_strings": { "ai": "Chebyshev ripple in dB. Small positive values (e.g., 0-3 dB) typical." } }, "type": "FLOAT32", "precision": 1, "constraint": { "type": "FLOAT_RANGE", "float_range": { "min_value": -30.0, "max_value": 30.0, "display_min": -30.0, "display_max": 30.0, "step": 1.0 } } },
        "resp": { "name": { "display_strings": { "ai": "Filter response type. Choose Butterworth, Cheb II, or Legendre." } }, "type": "STRING", "constraint": { "type": "STRING_CHOICE", "string_choice": { "choices": ["Butterworth", "Cheb II", "Legendre"] } } },
        "volume": { "name": { "display_strings": { "ai": "Output volume level in percent (0-100%)." } }, "type": "FLOAT32", "constraint": { "type": "FLOAT_RANGE", "float_range": { "min_value": 0.0, "max_value": 100.0, "display_min": 0.0, "display_max": 100.0, "step": 1.0 } } },
        "pan": { "name": { "display_strings": { "ai": "Stereo pan position (-100 = left, 0 = center, 100 = right)." } }, "type": "INT32", "constraint": { "type": "INT_RANGE", "int32_range": { "min_value": -100, "max_value": 100, "display_min": -100, "display_max": 100, "step": 1 } } }
      },
      "value": {
        "struct_array_values": {
          "struct_values": [
            {
              "fields": {
                "gain": { "float32_value": 0.0 },
                "input": { "float32_value": 0.0 },
                "inputLabel": { "string_value": "Channel 1" },
                "invert": { "string_value": "Invert" },
                "roll_off": { "float32_value": 24.0 },
                "frequency": { "float32_value": 85.0 },
                "ripple": { "float32_value": 3.0 },
                "resp": { "string_value": "Cheb II" },
                "volume": { "float32_value": 50.0 },
                "pan": { "int32_value": 0 }
              }
            },
            {
              "fields": {
                "gain": { "float32_value": 0.0 },
                "input": { "float32_value": 0.0 },
                "inputLabel": { "string_value": "Channel 2" },
                "invert": { "string_value": "Invert" },
                "roll_off": { "float32_value": 24.0 },
                "frequency": { "float32_value": 85.0 },
                "ripple": { "float32_value": 3.0 },
                "resp": { "string_value": "Cheb II" },
                "volume": { "float32_value": 50.0 },
                "pan": { "int32_value": 0 }
              }
            },
            {
              "fields": {
                "gain": { "float32_value": 0.0 },
                "input": { "float32_value": 0.0 },
                "inputLabel": { "string_value": "Channel 3" },
                "invert": { "string_value": "Invert" },
                "roll_off": { "float32_value": 24.0 },
                "frequency": { "float32_value": 85.0 },
                "ripple": { "float32_value": 3.0 },
                "resp": { "string_value": "Cheb II" },
                "volume": { "float32_value": 50.0 },
                "pan": { "int32_value": 0 }
              }
            },
            {
              "fields": {
                "gain": { "float32_value": 0.0 },
                "input": { "float32_value": 0.0 },
                "inputLabel": { "string_value": "Channel 4" },
                "invert": { "string_value": "Invert" },
                "roll_off": { "float32_value": 24.0 },
                "frequency": { "float32_value": 85.0 },
                "ripple": { "float32_value": 3.0 },
                "resp": { "string_value": "Cheb II" },
                "volume": { "float32_value": 50.0 },
                "pan": { "int32_value": 0 }
              }
            },
            {
              "fields": {
                "gain": { "float32_value": 0.0 },
                "input": { "float32_value": 0.0 },
                "inputLabel": { "string_value": "Channel 5" },
                "invert": { "string_value": "Invert" },
                "roll_off": { "float32_value": 24.0 },
                "frequency": { "float32_value": 85.0 },
                "ripple": { "float32_value": 3.0 },
                "resp": { "string_value": "Cheb II" },
                "volume": { "float32_value": 50.0 },
                "pan": { "int32_value": 0 }
              }
            },
            {
              "fields": {
                "gain": { "float32_value": 0.0 },
                "input": { "float32_value": 0.0 },
                "inputLabel": { "string_value": "Channel 6" },
                "invert": { "string_value": "Invert" },
                "roll_off": { "float32_value": 24.0 },
                "frequency": { "float32_value": 85.0 },
                "ripple": { "float32_value": 3.0 },
                "resp": { "string_value": "Cheb II" },
                "volume": { "float32_value": 50.0 },
                "pan": { "int32_value": 0 }
              }
            },
            {
              "fields": {
                "gain": { "float32_value": 0.0 },
                "input": { "float32_value": 0.0 },
                "inputLabel": { "string_value": "Channel 7" },
                "invert": { "string_value": "Invert" },
                "roll_off": { "float32_value": 24.0 },
                "frequency": { "float32_value": 85.0 },
                "ripple": { "float32_value": 3.0 },
                "resp": { "string_value": "Cheb II" },
                "volume": { "float32_value": 50.0 },
                  "pan": { "int32_value": 0 }
              }
            },
            {
              "fields": {
                "gain": { "float32_value": 0.0 },
                "input": { "float32_value": 0.0 },
                "inputLabel": { "string_value": "Channel 8" },
                "invert": { "string_value": "Invert" },
                "roll_off": { "float32_value": 24.0 },
                "frequency": { "float32_value": 85.0 },
                "ripple": { "float32_value": 3.0 },
                "resp": { "string_value": "Cheb II" },
                "volume": { "float32_value": 50.0 },
                "pan": { "int32_value": 0 }
              }
            }
          ]
        }
      }
    },
    "product": {
      "type": "STRUCT",
      "read_only": true,
      "value": {
        "struct_value": {
          "fields": {
            "name": { "string_value": "Audio Deck" },
            "vendor": { "string_value": "Ross Video" },
            "version": { "string_value": "1.0.0" },
            "serial_number": { "string_value": "SN-7K9M-2024-XR485-BLU" }
          }
        }
      },
      "params": {
        "name": {
          "type": "STRING"
        },
        "vendor": {
          "type": "STRING"
        },
        "version": {
          "type": "STRING"
        },
        "st2138_sdk": {
          "type": "STRING"
        },
        "st2138_sdk_version": {
          "type": "STRING"
        },
        "serial_number": {
          "type": "STRING"
        }
      }
    }
  },
  "commands": {
    "add_channel": {
      "name": {"display_strings": {
        "en": "Add Channel",
        "fr": "Ajouter un canal",
        "es": "Agregar canal",
        "ja": "チャンネルを追加"
      }},
      "type": "STRING",
      "widget": "button",
      "response": false
    }
  }
}
