{
  "slot": 0,
  "multi_set_enabled": true,
  "detail_level": "FULL",
  "access_scopes": ["st2138:mon", "st2138:op", "st2138:cfg", "st2138:adm"],
  "default_scope": "st2138:op",
  "language_packs": {
    "packs": {
      "es": {
        "name": "Spanish",
        "words": {
          "greeting": "Hola",
          "parting": "Adiós"
        }
      },
      "en": {
        "name": "English",
        "words": {
          "greeting": "Hello",
          "parting": "Goodbye"
        }
      },
      "fr": {
        "name": "French",
        "words": {
          "greeting": "Bonjour",
          "parting": "Adieu"
        }
      }
    }
  },
  "params": {
    "product": {
      "type": "STRUCT",
      "access_scope": "st2138:mon",
      "read_only": true,
      "value": {
        "struct_value": {
          "fields": {
            "name": { "string_value": "External Object Request" },
            "vendor": { "string_value": "Ross Video" },
            "version": { "string_value": "1.0.0" },
            "serial_number": { "string_value": "SN-7K9M-2024-XR485-BLU" }
          }
        }
      },
      "params": {
        "name": {
          "type": "STRING"
        },
        "vendor": {
          "type": "STRING"
        },
        "version": {
          "type": "STRING"
        },
        "catena_sdk": {
          "type": "STRING"
        },
        "catena_sdk_version": {
          "type": "STRING"
        },
        "serial_number": {
          "type": "STRING"
        }
      }
    }
  }
}